{"component_risks":{"action_risk":8,"behavior_risk":48,"delegation_risk":12,"identity_risk":18,"intent_risk":10,"transaction_risk":14},"decided_at":"2023-11-14T22:13:20Z","decision":"ALLOW_WITH_MONITORING","evaluation_id":"eval_vi_1700000000","reasons":[],"remediation":{"message":"The verified L1-L2-L3 chain is evidence for who authorized the agent and what was authorized. 279.99 USD is inside the 100.00-400.00 range, the SKU is on the line-item allowlist, and the listed unit price matches the charge. No behavior history is on file, so the decision is ALLOW_WITH_MONITORING rather than ALLOW. Nothing here revokes the grant."},"required_action":"NONE","risk_score":35}
