{"component_risks":{"action_risk":88,"behavior_risk":35,"delegation_risk":10,"identity_risk":12,"intent_risk":96,"transaction_risk":70},"decided_at":"2026-10-04T14:02:12Z","decision":"BLOCK","evaluation_id":"eval_8812","policy_violations":["MAX_AMOUNT_EXCEEDED"],"reasons":["ACTION_EXCEEDS_INTENT","DELEGATION_SCOPE_MISMATCH"],"remediation":{"message":"The proposed purchase (CAD 4,200) exceeds the declared intent ceiling (CAD 1,500). The principal may approve this specific action or re-declare intent with a higher limit."},"required_action":"HUMAN_APPROVAL","risk_score":94}