{"component_risks":{"action_risk":8,"behavior_risk":48,"delegation_risk":16,"identity_risk":22,"intent_risk":10,"transaction_risk":14},"decided_at":"2026-04-28T02:12:50Z","decision":"ALLOW_WITH_MONITORING","evaluation_id":"eval_ap2_1777342370","reasons":[],"remediation":{"message":"The verified open checkout and open payment mandates, with a closed payment inside them, are evidence for who authorized the agent and what was authorized. 199.00 USD is under the 200.00 ceiling and matches the example checkout product.price. The sample names no user subject and no behavior history, so the decision is ALLOW_WITH_MONITORING rather than ALLOW."},"required_action":"NONE","risk_score":36}
