{"component_risks":{"action_risk":55,"behavior_risk":72,"delegation_risk":15,"identity_risk":10,"intent_risk":58,"transaction_risk":48},"decided_at":"2026-10-04T14:21:45Z","decision":"STEP_UP","evaluation_id":"eval_9047","policy_violations":["AMOUNT_ABOVE_INTENT_CEILING","NEW_PAYEE_OUTSIDE_ALLOWLIST"],"reasons":["AMOUNT_ABOVE_INTENT_CEILING","NEW_PAYEE","UNUSUAL_AGENT_BEHAVIOR"],"remediation":{"message":"Transfer is above the intent ceiling (CAD 500) to a first-time payee, with unusual session velocity. The principal should confirm this specific payment before it proceeds."},"required_action":"HUMAN_APPROVAL","risk_score":68}