{"component_risks":{"action_risk":82,"behavior_risk":78,"delegation_risk":45,"identity_risk":12,"intent_risk":84,"transaction_risk":55},"decided_at":"2026-10-04T14:05:34Z","decision":"BLOCK","evaluation_id":"eval_8820","policy_violations":["ACTION_VERB_NOT_IN_DELEGATION_SCOPE","SCOPE_EXPANSION"],"reasons":["DELEGATION_SCOPE_MISMATCH","UNUSUAL_AGENT_BEHAVIOR"],"remediation":{"message":"The agent's delegation covers shopping actions only (search, compare, purchase). Accessing an investment account is outside that scope and follows a blocked purchase attempt. A new, explicitly scoped delegation is required."},"required_action":"HUMAN_APPROVAL","risk_score":89}