{"component_risks":{"action_risk":78,"behavior_risk":12,"delegation_risk":8,"identity_risk":8,"intent_risk":30,"transaction_risk":80},"decided_at":"2026-10-04T14:06:12Z","decision":"BLOCK","evaluation_id":"eval_8813","policy_violations":["QUOTE_TOLERANCE","FEE_POLICY"],"reasons":["CHARGE_EXCEEDS_QUOTE","CHARGE_EXCEEDS_LISTED","UNDISCLOSED_FEE"],"remediation":{"message":"The agent, the delegation, and the CAD 1,500 ceiling are valid. The charge is CAD 1,300 against a CAD 1,000 quote and list (1.30x, outside this intent's 1.15 band) and includes an undisclosed CAD 300 service fee. The principal may accept this charge or reject it. Accepting it does not raise the ceiling and does not revoke the delegation."},"required_action":"HUMAN_APPROVAL","risk_score":76}